{
    "slug": "despedida-kass-brian",
    "eventType": "despedida",
    "title": "Despedida de Solteros | Kass & Brian",
    "seo": {
        "description": "¡Estás invitad@ a nuestra Despedida de Solteros! 🎉 Kass & Brian — 17 de octubre 2026. ¡No faltes!",
        "shareImage": "share-preview.png"
    },
    "theme": {
        "primaryHue": 215,
        "primarySat": 75,
        "accentHue": 195,
        "fontBody": "Quicksand",
        "fontDisplay": "Caveat"
    },
    "hero": {
        "subtitle": "¡Despedida de Solteros!",
        "name": "Kass & Brian",
        "date": "17 DE OCTUBRE DE 2026",
        "backgroundImage": "hero-pareja.png",
        "song": ""
    },
    "intro": {
        "message": "Estamos a un paso del altar y queremos festejarlo contigo.",
        "label": "Te invitamos a nuestra",
        "parent1": "",
        "parent2": "",
        "closingMessage": "Despedida Mixta"
    },
    "padrinos": {
        "enabled": false,
        "label": "",
        "subtitle": "",
        "padrino1": "",
        "padrino2": ""
    },
    "countdown": {
        "targetDate": "2026-10-17T19:00:00",
        "displayDate": "sábado, 17 de octubre",
        "displayYear": "2026"
    },
    "calendar": {
        "title": "Despedida de Kass & Brian",
        "description": "¡Ven a celebrar con nosotros nuestra despedida de solteros!",
        "location": "Casa de Rebeca",
        "startDateTime": "20261017T180000",
        "endDateTime": "20261017T235900",
        "outlookStart": "2026-10-17T18:00:00",
        "outlookEnd": "2026-10-17T23:59:00",
        "icsFilename": "despedida-kass-brian.ics",
        "icsProdId": "Despedida | Kass & Brian"
    },
    "events": [
        {
            "icon": "party",
            "title": "Despedida de Solteros",
            "location": "Casa de Rebeca",
            "address": "Juan Balderas #308, Soberana Convención",
            "time": "19:00",
            "mapLink": "https://maps.app.goo.gl/ikDejXUNEi87Dd1B8"
        }
    ],
    "dressCode": {
        "enabled": true,
        "type": "Casual y Cómodo",
        "image": ""
    },
    "gallery": {
        "photos": []
    },
    "gifts": {
        "enabled": true,
        "title": "Lluvia de Regalos",
        "message": "Nuestra temática será de productos de despensa y limpieza para nuestro nuevo hogar. ¡Cualquier detalle será muy útil!",
        "type": "none",
        "envelopeText": "",
        "envelopeDescription": "",
        "link": "",
        "linkText": ""
    },
    "itinerary": {
        "enabled": false,
        "items": []
    },
    "rsvp": {
        "mode": "whatsapp",
        "whatsappNumber": "524491234567",
        "whatsappConfirmMessage": "¡Hola! Soy {name}. Confirmo mi asistencia a la despedida para {guests} persona(s). 🎉",
        "whatsappDeclineMessage": "Hola! Soy {name}. Lamentablemente no podré asistir a la despedida.",
        "deadline": "Por favor confirma tu asistencia a más tardar el 10 de octubre",
        "directMessage": {
            "enabled": false
        }
    },
    "footer": {
        "name": "Kass & Brian",
        "subtitle": "Despedida de Solteros • sábado, 17 de octubre"
    }
}
