{
    "slug": "michel-mtz",
    "eventType": "xv",
    "title": "XV Años | Michel Mtz Valdez",
    "theme": {
        "primaryHue": 160,
        "primarySat": 50,
        "accentHue": 45,
        "fontBody": "Montserrat",
        "fontDisplay": "Great Vibes"
    },
    "hero": {
        "subtitle": "✨ Mis XV Años ✨",
        "name": "Michel Guadalupe Martinez Valdez ",
        "date": "27 DE JUNIO DE 2026",
        "backgroundImage": "hero-bg.png",
        "song": "Ma-Belle-Evangeline.mp3"
    },
    "seo": {
        "shareImage": "og-preview.png"
    },
    "intro": {
        "message": "Con la bendición de Dios y de mis papás",
        "label": "Mis Papás",
        "parent1": "Favian de Jesús Martinez Valdez",
        "parent2": "Blanca Esthela Valdez Marcial",
        "closingMessage": "Tienen el honor de invitarte a celebrar los XV Años de su hija"
    },
    "padrinos": {
        "enabled": true,
        "label": "Mis Padrinos",
        "subtitle": "Con el cariño de",
        "padrino1": "Gerardo Hernandez ",
        "photo1": "",
        "padrino2": "Marcela Martínez",
        "photo2": ""
    },
    "countdown": {
        "targetDate": "2026-06-27T19:00:00",
        "displayDate": "sábado, 27 de junio",
        "displayYear": "2026"
    },
    "calendar": {
        "title": "XV Años | Michel Mtz Valdez",
        "description": "¡Celebra los XV Años de Melani Marisol con nosotros!",
        "location": "Salon Santa María",
        "startDateTime": "20260627T190000",
        "endDateTime": "20260628T020000",
        "outlookStart": "2026-06-27T19:00:00",
        "outlookEnd": "2026-06-28T02:00:00",
        "icsFilename": "xv-michel-mtz.ics",
        "icsProdId": "XV Años | Michel Mtz Valdez"
    },
    "events": [
        {
            "icon": "party",
            "title": "Recepción",
            "location": "Salon Santa María",
            "address": "",
            "time": "8:00 PM",
            "mapLink": "https://maps.app.goo.gl/xxpZTBWup9PXesn97"
        }
    ],
    "dressCode": {
        "enabled": true,
        "type": "Formal",
        "image": "dresscode-icon.png"
    },
    "gallery": {
        "photos": [
            {
                "src": "1.webp",
                "caption": "La Princesa"
            },
            {
                "src": "2.webp",
                "caption": "Mis Momentos"
            },
            {
                "src": "3.webp",
                "caption": "En familia"
            },
            {
                "src": "4.webp",
                "caption": "Mis XV"
            }
        ]
    },
    "gifts": {
        "enabled": true,
        "title": "Mesa de Regalos",
        "message": "Tu presencia es mi mayor regalo, pero si deseas tener un detalle conmigo:",
        "type": "envelope",
        "envelopeText": "Lluvia de Sobres",
        "envelopeDescription": "Es una tradición de ahora regalar efectivo en sobres que estarán a la entrada de la fiesta para colocarse en un buzón.",
        "link": "",
        "linkText": ""
    },
    "itinerary": {
        "enabled": true,
        "decorationImage": "tiana-sketch.png",
        "items": [
            {
                "time": "8:00 PM",
                "event": "Salon Santa Maria",
                "icon": "party",
                "description": ""
            },
            {
                "time": "9:00 PM",
                "event": "Vals",
                "icon": "music",
                "description": "Momento Especial"
            },
            {
                "time": "9:30 PM",
                "event": "Cena",
                "icon": "food",
                "description": "Banquete en Salon Santa Maria"
            }
        ]
    },
    "rsvp": {
        "mode": "whatsapp",
        "whatsappNumber": "524496291307",
        "whatsappConfirmMessage": "🐸👑 ¡Hola! Soy {name}. Confirmo mi asistencia a los XV Años de Michel Guadalupe para {guests} persona(s). ¡Nos vemos en la fiesta! 🎉✨",
        "whatsappDeclineMessage": "Hola! Soy {name}. Lamentablemente no podré asistir a los XV Años de Michel Guadalupe, pero le deseo lo mejor en esta hermosa celebración. ¡Muchas felicidades! 💚",
        "deadline": "Por favor confirma tu asistencia",
        "directMessage": {
            "enabled": false,
            "number": "524495915005",
            "text": "¡Felices XV años Melani! Te deseo lo mejor en tu día. 🎉👑",
            "label": "¿Quieres enviarle un mensaje a la festejada?",
            "buttonText": "Enviar mensaje a Melani 💚"
        }
    },
    "footer": {
        "name": "Michel Guadalupe Martinez Valdez",
        "subtitle": "XV Años - sábado, 27 de junio",
        "emojis": [
            "🐸",
            "👑",
            "🪷"
        ]
    }
}