{
    "slug": "jose-raul",
    "eventType": "xv",
    "title": "XV Años | José Raúl",
    "seo": {
        "description": "Estás invitado a una gran fiesta vaquera para celebrar los XV años de José Raúl.",
        "shareImage": "og-preview.jpg"
    },
    "theme": {
        "primaryHue": 26,
        "primarySat": 68,
        "accentHue": 42,
        "fontBody": "Roboto Slab",
        "fontDisplay": "Rye"
    },
    "hero": {
        "subtitle": "MIS XV AÑOS",
        "name": "José Raúl",
        "date": "15 DE AGOSTO DE 2026",
        "backgroundImage": "hero-bg-v2.webp",
        "song": "ilusion-98.mp3"
    },
    "intro": {
        "message": "Con la bendición de Dios",
        "label": "Mis Papás",
        "parent1": "Raúl Cabral Gonzáles",
        "parent2": "Marijose Hernández Rgl.",
        "closingMessage": "Tienen el honor de invitarte a celebrar los XV Años"
    },
    "padrinos": {
        "enabled": true,
        "label": "Mis Padrinos",
        "subtitle": "Con el cariño de",
        "groups": [
            {
                "padrino1": "Eduardo Alvarez",
                "padrino2": "Viridiana Hernández Rgl."
            },
            {
                "padrino1": "J. Manuel Ruiz",
                "padrino2": "Nayeli Hernández Rgl"
            }
        ]
    },
    "countdown": {
        "targetDate": "2026-08-15T14:00:00",
        "displayDate": "sábado, 15 de agosto",
        "displayYear": "2026"
    },
    "calendar": {
        "title": "XV Años | José Raúl",
        "description": "¡Celebra con nosotros!",
        "location": "Salón el Arco, Calle de el jinete #209 Col. Lienzo Charro",
        "startDateTime": "20260815T140000",
        "endDateTime": "20260815T210000",
        "outlookStart": "2026-08-15T14:00:00",
        "outlookEnd": "2026-08-15T21:00:00",
        "icsFilename": "jose-raul.ics",
        "icsProdId": "XV Años | José Raúl"
    },
    "events": [
        {
            "icon": "church",
            "title": "Misa",
            "location": "Templo de la Virgen de los Dolores",
            "address": "De Las Rosas 311, Las Flores.",
            "time": "14:00",
            "mapLink": "https://maps.app.goo.gl/mtW37HUYnn8vQozY8"
        },
        {
            "icon": "party",
            "title": "Recepción",
            "location": "Salón el Arco",
            "address": "Calle de el jinete #209 Col. Lienzo Charro",
            "time": "17:00",
            "mapLink": "https://maps.app.goo.gl/sRNtoS9f2Vg6rgRz8"
        }
    ],
    "dressCode": {
        "enabled": false,
        "type": "Formal",
        "image": "dresscode-icon.png"
    },
    "gallery": {
        "photos": [
            {
                "src": "gallery-01.webp"
                
            },
            {
                "src": "gallery-02.webp"
            },
            {
                "src": "gallery-03.webp"
            },
            {
                "src": "gallery-04.webp"
            },
            {
                "src": "gallery-05.webp"
            },
            {
                "src": "gallery-07.webp"
            },
            {
                "src": "gallery-06.webp"
            }
        ]
    },
    "gifts": {
        "enabled": false,
        "title": "Mesa de Regalos",
        "message": "Tu presencia es mi mayor regalo, pero si deseas tener un detalle conmigo:",
        "type": "envelope",
        "envelopeText": "Lluvia de Sobres",
        "envelopeDescription": "Tradición de regalar efectivo en sobres.",
        "link": "",
        "linkText": "Ver Mesa de Regalos"
    },
    "itinerary": {
        "enabled": false,
        "items": []
    },
    "rsvp": {
        "mode": "none",
        "whatsappNumber": "",
        "whatsappConfirmMessage": "¡Hola! Soy {name}. Confirmo mi asistencia para {guests} persona(s). 🎉",
        "whatsappDeclineMessage": "Hola! Soy {name}. Lamentablemente no podré asistir.",
        "deadline": "Por favor confirma tu asistencia",
        "directMessage": {
            "enabled": false
        }
    },
    "footer": {
        "name": "José Raúl",
        "subtitle": "XV Años - sábado, 15 de agosto"
    }
}
